{
  "$comment": "Example output of the knowledge-resolver for a knowledge-aware skill. Generic and safe. Not a runtime artifact.",
  "context_pack_version": "0.1.0",
  "task": {
    "id": "task_2026-05-28_feat-001",
    "purpose": "Decide whether the proposed checkout simplification should ship as-is.",
    "audience": "internal_review",
    "risk_class": "medium",
    "scope_tags": [
      "feature_governance",
      "customer_facing_experience",
      "interface_change"
    ]
  },
  "agent": {
    "id": "product-agent",
    "trust_boundary": "project-acme-internal"
  },
  "skill": {
    "id": "feature-value-governance",
    "version": "0.1.0",
    "mode": "knowledge_aware"
  },
  "knowledge_dependencies_resolution": {
    "strategic_framework": {
      "required": true,
      "satisfied_by": {
        "source_id": "example-4-layers",
        "source_version": "1.0.0",
        "retrieved_scope": "capsule",
        "retrieval_mode_applied": "capsule_first"
      }
    },
    "personas": {
      "required": false,
      "satisfied_by": {
        "source_id": "example-persona-casual-shopper",
        "source_version": "0.4.0",
        "retrieved_scope": "capsule",
        "retrieval_mode_applied": "capsule_first"
      }
    },
    "accessibility_guidelines": {
      "required_when_matched": true,
      "satisfied_by": {
        "source_id": "wcag-internal",
        "source_version": "1.2.0",
        "retrieved_scope": "excerpt",
        "retrieval_mode_applied": "excerpt_only"
      }
    },
    "operating_model": {
      "required_when_matched": false,
      "satisfied_by": null,
      "fallback_applied": "omit_silently"
    }
  },
  "restrictions_active": [
    "no_verbatim_for:example-4-layers",
    "no_export_for:example-4-layers",
    "citation_required_for:example-4-layers",
    "citation_required_for:wcag-internal"
  ],
  "conflicts_detected": [
    {
      "conflict_id": "conflict_2026-05-28_001",
      "between": [
        "example-persona-casual-shopper@0.4.0",
        "wcag-internal@1.2.0"
      ],
      "topic": "explicit form labels on checkout fields",
      "resolved_by": "source_precedence_policy",
      "prevailing_source": "wcag-internal@1.2.0",
      "suppressed_sources": ["example-persona-casual-shopper@0.4.0"],
      "human_review_required": false
    }
  ],
  "gaps": [],
  "human_review": {
    "required": false,
    "reasons": []
  },
  "audit_log_entries_to_write": [
    {
      "source_id": "example-4-layers",
      "source_version": "1.0.0",
      "retrieved_scope": "capsule",
      "sensitivity": "internal",
      "authority_level": "interpretive"
    },
    {
      "source_id": "example-persona-casual-shopper",
      "source_version": "0.4.0",
      "retrieved_scope": "capsule",
      "sensitivity": "internal",
      "authority_level": "evidence_proxy"
    },
    {
      "source_id": "wcag-internal",
      "source_version": "1.2.0",
      "retrieved_scope": "excerpt",
      "sensitivity": "internal",
      "authority_level": "normative"
    }
  ]
}
